{
  "id": "shopify-script-tags-stop-running",
  "provider": "shopify",
  "title": "Shopify script tags stop running on storefronts on 2027-03-01",
  "summary": "Script tags are deprecated in every Admin API version. Since October 1, 2026 the REST ScriptTag resource rejects POST and PUT and the GraphQL scriptTagCreate and scriptTagUpdate mutations return a user error; on March 1, 2027 Shopify stops injecting existing script tags into storefronts, so their JavaScript no longer loads. Listing and deleting script tags keeps working.",
  "endpoint": {
    "method": "*",
    "path": "/admin/api/{version}/script_tags**"
  },
  "changeClass": "version-sunset",
  "trigger": {
    "any": true
  },
  "firstObserved": null,
  "publishedNotice": {
    "date": "2026-08-24",
    "url": "https://shopify.dev/changelog/online-store-script-tags-deprecation"
  },
  "effectiveDate": "2027-03-01",
  "severity": "high",
  "migrationNote": "Stop creating or updating script tags (POST /admin/api/{version}/script_tags.json and PUT .../script_tags/{script_tag_id}.json already fail). Move storefront scripts to app embed blocks in a theme app extension, and analytics or conversion scripts to a web pixel; then delete the old script tags. Pinning an older API version does not delay this.",
  "sources": [
    "https://shopify.dev/changelog/online-store-script-tags-deprecation",
    "https://shopify.dev/docs/api/admin-rest/latest/resources/scripttag"
  ],
  "status": "verified",
  "provenance": [
    {
      "url": "https://shopify.dev/changelog/online-store-script-tags-deprecation",
      "quote": "Starting October 1, 2026, the scriptTagCreate and scriptTagUpdate mutations will return an user error, and the ScriptTag REST Admin API resource will reject POST and PUT. The deprecation applies to all API versions, including older ones, so pinning won't defer it.",
      "sourceSha256": "e0e3e3139261f5db2505611115e6171fee7819959516058cd80dbb3f46804cae",
      "fetchedAt": "2026-10-31T01:30:26.274Z"
    }
  ]
}
