{
  "id": "shopify-admin-api-2026-01-unsupported",
  "provider": "shopify",
  "title": "Shopify Admin API version 2026-01 becomes unsupported on 2027-01-16",
  "summary": "Admin API version 2026-01 is accessible until January 16, 2027 15:00 UTC. After that, requests to /admin/api/2026-01/... (REST and GraphQL) and webhooks pinned to 2026-01 fall forward to the oldest accessible stable version without an error, so responses can change shape silently. Every app still pinned to 2026-01 is hit.",
  "endpoint": {
    "method": "*",
    "path": "/admin/api/2026-01/**"
  },
  "changeClass": "version-sunset",
  "trigger": {
    "any": true
  },
  "firstObserved": null,
  "publishedNotice": {
    "date": null,
    "url": "https://shopify.dev/docs/api/usage/versioning"
  },
  "effectiveDate": "2027-01-16",
  "severity": "critical",
  "migrationNote": "Move the version segment in your Admin API URLs and webhook subscriptions to a supported version (2026-04 or later; 2026-10 is the latest stable), work through the release notes for every version in between, and check the X-Shopify-API-Version response header to confirm Shopify is not falling forward.",
  "recipeId": "apply-fix",
  "fix": {
    "path": {
      "from": "/admin/api/2026-01/",
      "to": "/admin/api/2026-10/"
    }
  },
  "sources": [
    "https://shopify.dev/docs/api/usage/versioning"
  ],
  "status": "verified",
  "provenance": [
    {
      "url": "https://shopify.dev/docs/api/usage/versioning",
      "quote": "2026-01 January 1, 2026 January 16, 2027 15:00 UTC",
      "sourceSha256": "59fcaa7a0bb432d522633a6f80967f234d953723a4cedf63be2900522da11dd4",
      "fetchedAt": "2026-10-31T01:37:43.952Z"
    }
  ]
}
