{
  "id": "openai-assistants-api-shutdown",
  "provider": "openai",
  "title": "Assistants API removed on 2026-08-26",
  "summary": "OpenAI removed the Assistants API on 2026-08-26, one year after its 2025-08-26 deprecation notice. Calls to the assistants endpoints, and to the threads, messages and runs endpoints that go with them (/v1/threads/**), no longer work. The replacement is the Responses API plus the Conversations API.",
  "endpoint": {
    "method": "*",
    "path": "/v1/assistants/**"
  },
  "changeClass": "version-sunset",
  "trigger": {
    "any": true
  },
  "firstObserved": null,
  "publishedNotice": {
    "date": "2025-08-26",
    "url": "https://developers.openai.com/api/docs/deprecations"
  },
  "effectiveDate": "2026-08-26",
  "severity": "critical",
  "migrationNote": "Move assistants to prompts (configuration created in the dashboard), threads to Conversations, and runs to Responses (send input items or a conversation id to the Responses API), and run the tool-call loop in your own code. Thread messages can no longer be fetched from the API, so read history from your own stored copy.",
  "sources": [
    "https://developers.openai.com/api/docs/deprecations",
    "https://developers.openai.com/api/docs/assistants/migration"
  ],
  "status": "verified",
  "provenance": [
    {
      "url": "https://developers.openai.com/api/docs/deprecations",
      "quote": "On August 26th, 2025, we notified developers using the Assistants API of its deprecation and removal from the API one year later, on August 26, 2026.",
      "sourceSha256": "2724fd9e195f6c4e8c05c48f9b7b2d41a71be3b53f1f264ea47421b7519454df",
      "fetchedAt": "2026-10-31T01:21:45.290Z"
    },
    {
      "url": "https://developers.openai.com/api/docs/assistants/migration",
      "quote": "The Assistants API was officially sunset on August 26, 2026, and is no longer available.",
      "sourceSha256": "de42c67a699ddbe6924fb9d693515faeb6bf0c8d12106b8302483400b5dedc15",
      "fetchedAt": "2026-10-31T01:21:46.421Z"
    }
  ]
}
