{
  "id": "twilio-notify-end-of-life",
  "provider": "twilio",
  "title": "Twilio Notify reaches end of life on 2027-01-31",
  "summary": "Twilio Notify (notify.twilio.com, e.g. POST /v1/Services/{ServiceSid}/Notifications) has been unsupported and closed to new customers since October 2022 and reaches end of life for existing customers on 2027-01-31, per Twilio's Help Center (superseding the 2025-12-31 date in the January 2024 changelog). Push sent through Verify, Voice, Conversations or Engage is not affected.",
  "endpoint": {
    "method": "POST",
    "path": "/v1/Services/{ServiceSid}/Notifications"
  },
  "changeClass": "version-sunset",
  "trigger": {
    "any": true
  },
  "firstObserved": null,
  "publishedNotice": {
    "date": "2024-01-23",
    "url": "https://www.twilio.com/en-us/changelog/notify-api-end-of-life-further-extension-notice"
  },
  "effectiveDate": "2027-01-31",
  "severity": "critical",
  "migrationNote": "Move bulk SMS sends to the Messaging API (or Twilio's Bulk Messaging API) and push notifications to a direct APNs/FCM integration or another push provider, then remove Notify Services and Bindings.",
  "sources": [
    "https://help.twilio.com/articles/9198083260571-How-to-transition-off-Notify",
    "https://www.twilio.com/en-us/changelog/notify-api-eol-notice",
    "https://www.twilio.com/en-us/changelog/notify-api-end-of-life-further-extension-notice",
    "https://www.twilio.com/docs/notify/api/notification-resource"
  ],
  "status": "verified"
}
